{
  "schemaVersion": 1,
  "status": "complete",
  "objectiveAssertions": [
    {
      "id": "isolation-fresh-context",
      "status": "fail",
      "command": null,
      "exitCode": null,
      "durationMs": null,
      "evidenceTraceNames": [],
      "note": "The engineering-smoke example makes no fresh-context claim."
    }
  ],
  "subjectiveRatings": [
    {
      "id": "directive-compliance",
      "score": 1,
      "maxScore": 2,
      "rationale": "Replace with evidence from the observed worker run."
    },
    {
      "id": "memory-growth",
      "score": 1,
      "maxScore": 2,
      "rationale": "Replace with evidence from the observed worker run."
    },
    {
      "id": "routing-behavior",
      "score": 1,
      "maxScore": 2,
      "rationale": "Replace with evidence from the observed worker run."
    },
    {
      "id": "communication",
      "score": 1,
      "maxScore": 2,
      "rationale": "Replace with evidence from the observed worker run."
    },
    {
      "id": "product-fidelity",
      "score": 1,
      "maxScore": 2,
      "rationale": "Replace with evidence from the observed worker run."
    }
  ],
  "traces": [],
  "notes": [
    "Example input for runner plumbing only; replace every rating rationale before using a real run."
  ]
}
